Topic,Words,Frequency,Timestamp
-1,"non, type crssnp, chronic rhinosinusitis, sniffin sticks test, tissue interleukin levels",3,2023
0,"hpv, germany, anomaly detection, tolerance uncertainty, traits",11,2023
1,"baymedr, prescreening, factors, equivalence non inferiority, pandemic",7,2023
-1,"short term, eye tracking, chronic rhinosinusitis, plugin, smell",2,2024
0,"nostalgia, differences, psychotherapy, healthy life expectancy, fake news",11,2024
1,"strength statistical evidence, cancer drugs, eye tracking, anxiety, coronavirus",5,2024
-1,"sampling, rugby, sub saharan africa, families, web based",5,2025
0,"germany, job insecurity, childhood maltreatment, mental, preterm",11,2025
1,"neck, patients, bayesian, rate trial, cleft cysts cup",4,2025
