title,abstract,year,source,keyword,class_name,middle_group,subject_area,cluster,year_raw,clean_text,topic,topic_prob,topic_label
AI-assisted braintstorming for scenario thinking,"{This article returns to Alex Faickney Osborn's iconic 1953 book Applied Imagination in which the process of “brainstorming” was first introduced to academic audiences. In scenario thinking, the capacity to brainstorm is an essential, core component, even if few scholars and practitioners seem to return directly to Osborn's original insights about the disciplined application of imagination. As the futures and foresight science community braces for the impending impact of artificial intelligence, we return readers to the fact that Osborn's work, some 70 years ago, which championed human creativity, was written during the rise of the first “electronic brains” (i.e., computers) and all the potential implications of computing power for individuals in all realms of the thought industry. The purpose of this article, therefore, is to bring those AIs together in the context of scenario thinking; to recover seemingly lost insights from Osborn's notion of Applied Imagination and consider what those insights mean for our contemporary context rife with the opportunities but also concerns of Artificial Intelligence.}",2025,Futures,"{applied imagination,artificial intelligence,brainstorming,scenario thinking,scenarios}",Business and International Management,"Business, Management and Accounting",Social Sciences & Humanities,OTHER,2025,"ai-assisted braintstorming for scenario thinking {this article returns to alex faickney osborn's iconic 1953 book applied imagination in which the process of “brainstorming” was first introduced to academic audiences. in scenario thinking, the capacity to brainstorm is an essential, core component, even if few scholars and practitioners seem to return directly to osborn's original insights about the disciplined application of imagination. as the futures and foresight science community braces for the impending impact of artificial intelligence, we return readers to the fact that osborn's work, some 70 years ago, which championed human creativity, was written during the rise of the first “electronic brains” (i.e., computers) and all the potential implications of computing power for individuals in all realms of the thought industry. the purpose of this article, therefore, is to bring those ais together in the context of scenario thinking; to recover seemingly lost insights from osborn's notion of applied imagination and consider what those insights mean for our contemporary context rife with the opportunities but also concerns of artificial intelligence.} {applied imagination,artificial intelligence,brainstorming,scenario thinking,scenarios} {applied imagination,artificial intelligence,brainstorming,scenario thinking,scenarios}",-1,0.0,"germany, ontology, marriage, networks, multilingual"
Uncertainty reduction as an alternative explanation of historical myths,"{We agree with Sijilmassi et al. that historical myths are a tool for coalition recruitment. We argue, however, that a close fit between an evolved entity and an identified function does not imply that the latter is the critical evolutionary trigger. We also propose an alternative individual-centric explanation: Historical myths reduce uncertainty by providing cognitive and behavioral guidance.}",2025,Behavioral and Brain Sciences,,Physiology,"Biochemistry, Genetics and Molecular Biology",Life Sciences,OTHER,2025,"uncertainty reduction as an alternative explanation of historical myths {we agree with sijilmassi et al. that historical myths are a tool for coalition recruitment. we argue, however, that a close fit between an evolved entity and an identified function does not imply that the latter is the critical evolutionary trigger. we also propose an alternative individual-centric explanation: historical myths reduce uncertainty by providing cognitive and behavioral guidance.}",-1,0.0,"germany, ontology, marriage, networks, multilingual"
Let’s talk about language—and its role for replicability,"{Science strives towards a credible and comprehensive understanding of the world around us. Across disciplines within the social and behavioural sciences (and beyond), limitations in the implementation of the scientific approach have been identified in recent studies, showing low replicability of many results. This is an issue for knowledge accumulation, theory-building, and evidence-based decision and policy making. Researchers have proposed several solutions to address these issues, focusing mainly on improving statistical methods, data quality, and transparency. However, relatively little attention has been paid to another key aspect that affects replicability: language. Across fields, language plays a central role in all steps of the research cycle and is a critical communication tool among researchers. Neglecting its role may reduce replicability and limit our understanding of theoretically interesting differences and similarities across languages. After identifying these challenges, we provide some recommendations and an outlook on how replicability challenges related to language may be addressed.}",2025,Humanities and Social Sciences Communications,,Arts and Humanities (all),,,OTHER,2025,"let’s talk about language—and its role for replicability {science strives towards a credible and comprehensive understanding of the world around us. across disciplines within the social and behavioural sciences (and beyond), limitations in the implementation of the scientific approach have been identified in recent studies, showing low replicability of many results. this is an issue for knowledge accumulation, theory-building, and evidence-based decision and policy making. researchers have proposed several solutions to address these issues, focusing mainly on improving statistical methods, data quality, and transparency. however, relatively little attention has been paid to another key aspect that affects replicability: language. across fields, language plays a central role in all steps of the research cycle and is a critical communication tool among researchers. neglecting its role may reduce replicability and limit our understanding of theoretically interesting differences and similarities across languages. after identifying these challenges, we provide some recommendations and an outlook on how replicability challenges related to language may be addressed.}",-1,0.0,"germany, ontology, marriage, networks, multilingual"
Loneliness: A Scoping Review of Reviews From 2001 to 2023,"{The growing number of primary studies and reviews on loneliness, and the multidisciplinary efforts to comprehend this complex phenomenon from various perspectives, underscore the heightened recognition of its impact on individual and societal well-being and health. To comprehensively assess the size and scope of this research field, we conducted a scoping review of 35 English-language reviews of primary studies on loneliness, published between 2001 and 2023. Focusing specifically on psychological research, these reviews covered a total of N = 1,089 studies, which were conducted between 1986 and 2022. In addition to providing a broad overview of the structure of the field, the present scoping review aimed to explore the methodological landscape of loneliness research, including data collection, sample demographics, and measures, and to present key topics and evidence in the field. By deepening the understanding of loneliness and identifying data gaps and methodological challenges, our analyses provide critical insights for future research endeavors, thereby fostering advances in the field.}",2025,Journal of Psychology,"{content of research,loneliness,research methodology,scoping review of reviews,structure of the field}","Business, Management and Accounting (miscellaneous)","Business, Management and Accounting",Social Sciences & Humanities,OTHER,2025,"loneliness: a scoping review of reviews from 2001 to 2023 {the growing number of primary studies and reviews on loneliness, and the multidisciplinary efforts to comprehend this complex phenomenon from various perspectives, underscore the heightened recognition of its impact on individual and societal well-being and health. to comprehensively assess the size and scope of this research field, we conducted a scoping review of 35 english-language reviews of primary studies on loneliness, published between 2001 and 2023. focusing specifically on psychological research, these reviews covered a total of n = 1,089 studies, which were conducted between 1986 and 2022. in addition to providing a broad overview of the structure of the field, the present scoping review aimed to explore the methodological landscape of loneliness research, including data collection, sample demographics, and measures, and to present key topics and evidence in the field. by deepening the understanding of loneliness and identifying data gaps and methodological challenges, our analyses provide critical insights for future research endeavors, thereby fostering advances in the field.} {content of research,loneliness,research methodology,scoping review of reviews,structure of the field} {content of research,loneliness,research methodology,scoping review of reviews,structure of the field}",-1,0.0,"germany, ontology, marriage, networks, multilingual"
"Cultural identity development in adult forced migrants: The psychometrics of a measure in Arabic, Spanish, and Ukrainian","{The aim of the present study was to assess the psychometric equivalence of Arabic-, Spanish-, and Ukrainian-language versions of the Multigroup Ethnic and National Identity Measure (MENI), a measure of cultural identity development comprised of an ethic identity and a national identity scale. The psychometric properties of the three language versions were examined and confirmatory factor analysis (CFA) was conducted to evaluate model fit and test measurement invariance in a sample of adult forced migrants from Syria, Mexico, and Ukraine living in Canada (N = 616). Multigroup CFA provided support for scalar invariance of the ethnic identity scale, allowing meaningful comparisons across the three cultural/language groups. However, the national identity scale demonstrated only configural invariance, suggesting that, although the general structure was consistent, the strength and patterns of relationships differed across groups. The construct and criterion validity of both scales were adequate for assessing identification with the country of origin and the residence country across the three language groups. Based on these findings, we conclude that future research can use the Arabic-, Spanish-, and Ukrainian-language versions of the MENI to assess and compare cultural identity development across these cultural/language groups of adult (forced) migrants, derive identity statuses, and extract acculturation profiles.}",2025,International Journal of Intercultural Relations,"{adult forced migrants,cultural identity,ethnic identity,multigroup ethnic and national identity measure (meni),refugees}",Business and International Management,"Business, Management and Accounting",Social Sciences & Humanities,OTHER,2025,"cultural identity development in adult forced migrants: the psychometrics of a measure in arabic, spanish, and ukrainian {the aim of the present study was to assess the psychometric equivalence of arabic-, spanish-, and ukrainian-language versions of the multigroup ethnic and national identity measure (meni), a measure of cultural identity development comprised of an ethic identity and a national identity scale. the psychometric properties of the three language versions were examined and confirmatory factor analysis (cfa) was conducted to evaluate model fit and test measurement invariance in a sample of adult forced migrants from syria, mexico, and ukraine living in canada (n = 616). multigroup cfa provided support for scalar invariance of the ethnic identity scale, allowing meaningful comparisons across the three cultural/language groups. however, the national identity scale demonstrated only configural invariance, suggesting that, although the general structure was consistent, the strength and patterns of relationships differed across groups. the construct and criterion validity of both scales were adequate for assessing identification with the country of origin and the residence country across the three language groups. based on these findings, we conclude that future research can use the arabic-, spanish-, and ukrainian-language versions of the meni to assess and compare cultural identity development across these cultural/language groups of adult (forced) migrants, derive identity statuses, and extract acculturation profiles.} {adult forced migrants,cultural identity,ethnic identity,multigroup ethnic and national identity measure (meni),refugees} {adult forced migrants,cultural identity,ethnic identity,multigroup ethnic and national identity measure (meni),refugees}",-1,0.0,"germany, ontology, marriage, networks, multilingual"
Automatic Categorization of Software Repository Domains with Minimal Resources,"{Software categorization is a vital process involving the systematic grouping of software based on different criteria including the approach used and domain. This categorization has traditionally played a crucial role in software maintenance, aiding developers in locating specific programs, identifying their characteristics, and finding similar ones within extensive code repositories. However, manual categorization is known to be expensive, tedious, and time-consuming, highlighting the growing importance of automated categorization techniques. The objective is to develop a classifier capable of accurately and efficiently categorizing these repositories into predefined domains with less data. The contribution of this research is twofold. Firstly, we propose a model that enables the categorization of software repositories in terms of domains by using repository’s features, even with a limited amount of training data. Secondly, we conduct a comprehensive empirical evaluation to assess the impact of repository features and data augmentation technique on the task. This research aims to advance the field of software categorization, ultimately facilitating improved utilization of software repositories across diverse research domains.}",2025,Communications in Computer and Information Science,"{data augmentation,few-shot learning,llm,r code,software categorization}",Mathematics (all),,,OTHER,2025,"automatic categorization of software repository domains with minimal resources {software categorization is a vital process involving the systematic grouping of software based on different criteria including the approach used and domain. this categorization has traditionally played a crucial role in software maintenance, aiding developers in locating specific programs, identifying their characteristics, and finding similar ones within extensive code repositories. however, manual categorization is known to be expensive, tedious, and time-consuming, highlighting the growing importance of automated categorization techniques. the objective is to develop a classifier capable of accurately and efficiently categorizing these repositories into predefined domains with less data. the contribution of this research is twofold. firstly, we propose a model that enables the categorization of software repositories in terms of domains by using repository’s features, even with a limited amount of training data. secondly, we conduct a comprehensive empirical evaluation to assess the impact of repository features and data augmentation technique on the task. this research aims to advance the field of software categorization, ultimately facilitating improved utilization of software repositories across diverse research domains.} {data augmentation,few-shot learning,llm,r code,software categorization} {data augmentation,few-shot learning,llm,r code,software categorization}",-1,0.0,"germany, ontology, marriage, networks, multilingual"
Click-Click-Add – Product Search Strategies in Online Shopping,"{People shopping online often abandon their shopping sessions because they feel overwhelmed or insufficiently supported during product searches. We instructed 31 participants to perform two goal-directed product searches online, simulating real-world scenarios for two product types: search products (laptops) and experience products (jackets). Through observation and think-aloud protocols, we captured user behavior across browser tabs and online resources, enabling us to develop a novel annotation scheme for product search that captures resources used, views seen, and actions taken. Qualitative analysis of these annotated sessions revealed nine distinct product search strategies, which participants often combined and applied at different stages of their search sessions. For each strategy, we describe similarities and differences between search and experience products and identify common strategy combinations across product types. Finally, by mapping these findings to established information-seeking models, we offer insights that can inform the design of more effective and supportive e-commerce platforms.}",2025,Proceedings of the Association for Information Science and Technology,"{consumer decision-making,consumer information-seeking,search strategies,search vs. experience products,user behavior in e-commerce}",Computer Science (all),,,OTHER,2025,"click-click-add – product search strategies in online shopping {people shopping online often abandon their shopping sessions because they feel overwhelmed or insufficiently supported during product searches. we instructed 31 participants to perform two goal-directed product searches online, simulating real-world scenarios for two product types: search products (laptops) and experience products (jackets). through observation and think-aloud protocols, we captured user behavior across browser tabs and online resources, enabling us to develop a novel annotation scheme for product search that captures resources used, views seen, and actions taken. qualitative analysis of these annotated sessions revealed nine distinct product search strategies, which participants often combined and applied at different stages of their search sessions. for each strategy, we describe similarities and differences between search and experience products and identify common strategy combinations across product types. finally, by mapping these findings to established information-seeking models, we offer insights that can inform the design of more effective and supportive e-commerce platforms.} {consumer decision-making,consumer information-seeking,search strategies,search vs. experience products,user behavior in e-commerce} {consumer decision-making,consumer information-seeking,search strategies,search vs. experience products,user behavior in e-commerce}",-1,0.0,"germany, ontology, marriage, networks, multilingual"
"The Governance of Decentralized Autonomous Organizations: A Study of Contributors’ Influence, Networks, and Shifts in Voting Power","{We present a study analyzing the voting behavior of contributors, or vested users, in Decentralized Autonomous Organizations (DAOs). We evaluate their involvement in decision-making processes, discovering that in at least 7.54% of all DAOs, contributors, on average, held the necessary majority to control governance decisions. Furthermore, contributors have singularly decided at least one proposal in 20.41% of DAOs. Notably, contributors tend to be centrally positioned within the DAO governance ecosystem, suggesting the presence of inner power circles. Additionally, we observed a tendency for shifts in governance token ownership shortly before governance polls take place in 1202 (14.81%) of 8116 evaluated proposals. Our findings highlight the central role of contributors across a spectrum of DAOs, including Decentralized Finance protocols. Our research also offers important empirical insights pertinent to ongoing regulatory activities aimed at increasing transparency to DAO governance frameworks.}",2025,Lecture Notes in Computer Science (including subseries Lecture Notes in Artificial Intelligence and Lecture Notes in Bioinformatics),"{blockchain,dao,ethereum,governance,networks,voting}",Computer Science (all),,,OTHER,2025,"the governance of decentralized autonomous organizations: a study of contributors’ influence, networks, and shifts in voting power {we present a study analyzing the voting behavior of contributors, or vested users, in decentralized autonomous organizations (daos). we evaluate their involvement in decision-making processes, discovering that in at least 7.54% of all daos, contributors, on average, held the necessary majority to control governance decisions. furthermore, contributors have singularly decided at least one proposal in 20.41% of daos. notably, contributors tend to be centrally positioned within the dao governance ecosystem, suggesting the presence of inner power circles. additionally, we observed a tendency for shifts in governance token ownership shortly before governance polls take place in 1202 (14.81%) of 8116 evaluated proposals. our findings highlight the central role of contributors across a spectrum of daos, including decentralized finance protocols. our research also offers important empirical insights pertinent to ongoing regulatory activities aimed at increasing transparency to dao governance frameworks.} {blockchain,dao,ethereum,governance,networks,voting} {blockchain,dao,ethereum,governance,networks,voting}",-1,0.0,"germany, ontology, marriage, networks, multilingual"
Let’s talk about language—and its role for replicability,"{Science strives towards a credible and comprehensive understanding of the world around us. Across disciplines within the social and behavioural sciences (and beyond), limitations in the implementation of the scientific approach have been identified in recent studies, showing low replicability of many results. This is an issue for knowledge accumulation, theory-building, and evidence-based decision and policy making. Researchers have proposed several solutions to address these issues, focusing mainly on improving statistical methods, data quality, and transparency. However, relatively little attention has been paid to another key aspect that affects replicability: language. Across fields, language plays a central role in all steps of the research cycle and is a critical communication tool among researchers. Neglecting its role may reduce replicability and limit our understanding of theoretically interesting differences and similarities across languages. After identifying these challenges, we provide some recommendations and an outlook on how replicability challenges related to language may be addressed.}",2025,Humanities and Social Sciences Communications,,Psychology (all),,,OTHER,2025,"let’s talk about language—and its role for replicability {science strives towards a credible and comprehensive understanding of the world around us. across disciplines within the social and behavioural sciences (and beyond), limitations in the implementation of the scientific approach have been identified in recent studies, showing low replicability of many results. this is an issue for knowledge accumulation, theory-building, and evidence-based decision and policy making. researchers have proposed several solutions to address these issues, focusing mainly on improving statistical methods, data quality, and transparency. however, relatively little attention has been paid to another key aspect that affects replicability: language. across fields, language plays a central role in all steps of the research cycle and is a critical communication tool among researchers. neglecting its role may reduce replicability and limit our understanding of theoretically interesting differences and similarities across languages. after identifying these challenges, we provide some recommendations and an outlook on how replicability challenges related to language may be addressed.}",-1,0.0,"germany, ontology, marriage, networks, multilingual"
