title,abstract,year,source,keyword,class_name,middle_group,subject_area,cluster,year_raw,clean_text,topic,topic_prob,topic_label
Types of collaboration and the consolidation of sociological research: Evidence from publications in five German sociology journals 2000-2019,"{Research innovation can be fostered under the right circumstances, which include high levels of research autonomy, opportunities for collaborative research, and an open-minded research community able to combine innovation with more conventional lines of research. In the literature, different types of collaboration and team composition are linked to innovation. However, little is known about the association between collaborative research and the consolidation of thought products, innovative or not. We address this research gap based on 2,785 abstracts and 352 thought products' (theories, methods, research topics) extracted from five German language sociology journals included in Scopus and published between 2000 and 2019. We apply a diachronic research strategy and combine correspondence analysis for topic extraction, network analysis to account for the embeddedness of scholars, and OLS regression to investigate which of the factors present in 2000- 2003 are responsible for the consolidation of thought products in 2016-2019. We find that a focus on applied topics (such as management or governance) is positively linked to the consolidation of research. Furthermore, concepts used and disseminated by well-connected scholars between 2000 and 2003 tend to become peripheral over time. Finally, we establish a negative association between concepts used by female scholars and the consolidation of these concepts.}",2023,"Career Paths Inside and Outside Academia: Special Edition 26 der Zeitschrift ""Soziale Welt""","{bibliometrics,geometric data analysis,natural language processing,social network analysis,sociology,topic consolidation}",Social Sciences (all),,,OTHER,2023,"types of collaboration and the consolidation of sociological research: evidence from publications in five german sociology journals 2000-2019 {research innovation can be fostered under the right circumstances, which include high levels of research autonomy, opportunities for collaborative research, and an open-minded research community able to combine innovation with more conventional lines of research. in the literature, different types of collaboration and team composition are linked to innovation. however, little is known about the association between collaborative research and the consolidation of thought products, innovative or not. we address this research gap based on 2,785 abstracts and 352 thought products' (theories, methods, research topics) extracted from five german language sociology journals included in scopus and published between 2000 and 2019. we apply a diachronic research strategy and combine correspondence analysis for topic extraction, network analysis to account for the embeddedness of scholars, and ols regression to investigate which of the factors present in 2000- 2003 are responsible for the consolidation of thought products in 2016-2019. we find that a focus on applied topics (such as management or governance) is positively linked to the consolidation of research. furthermore, concepts used and disseminated by well-connected scholars between 2000 and 2003 tend to become peripheral over time. finally, we establish a negative association between concepts used by female scholars and the consolidation of these concepts.} {bibliometrics,geometric data analysis,natural language processing,social network analysis,sociology,topic consolidation} {bibliometrics,geometric data analysis,natural language processing,social network analysis,sociology,topic consolidation}",-1,0.0,"germany, ontology, marriage, networks, multilingual"
Improving the visibility of minorities through network growth interventions,"{Improving the position of minority groups in networks through interventions is a challenge of high theoretical and societal importance. However, a systematic analysis of interventions that alter the network growth process is still missing. In this work, we propose a model to examine how network growth interventions impact the position of minority nodes in degree rankings over time. We distinguish between (i) group size interventions, such as introducing quotas; and (ii) behavioural interventions, such as varying how groups connect to each other. We find that even extreme quotas do not increase minority representation in rankings if the actors in the network do not adopt homophilic behaviour. Thus, interventions need to be coordinated in order to improve the visibility of minorities. In a real-world case study, we explore which interventions can reach gender parity in academia. Our work provides a theoretical and computational framework for investigating the effectiveness of interventions in growing networks.}",2023,Communications Physics,,Physics and Astronomy (all),,,OTHER,2023,"improving the visibility of minorities through network growth interventions {improving the position of minority groups in networks through interventions is a challenge of high theoretical and societal importance. however, a systematic analysis of interventions that alter the network growth process is still missing. in this work, we propose a model to examine how network growth interventions impact the position of minority nodes in degree rankings over time. we distinguish between (i) group size interventions, such as introducing quotas; and (ii) behavioural interventions, such as varying how groups connect to each other. we find that even extreme quotas do not increase minority representation in rankings if the actors in the network do not adopt homophilic behaviour. thus, interventions need to be coordinated in order to improve the visibility of minorities. in a real-world case study, we explore which interventions can reach gender parity in academia. our work provides a theoretical and computational framework for investigating the effectiveness of interventions in growing networks.}",-1,0.0,"germany, ontology, marriage, networks, multilingual"
More than two intuitions,"{We consider an underdeveloped feature of De Neys's model. Decisions with multiple intuitions per option are neither trivial to explain nor rare. These decision scenarios are crucial for an assessment of the model's generalizability and adequacy. Besides monitoring absolute differences in intuition strength, the mind might add the strengths of intuitions per choice option, leading to competing and testable hypotheses.}",2023,Behavioral and Brain Sciences,,Physiology,"Biochemistry, Genetics and Molecular Biology",Life Sciences,OTHER,2023,"more than two intuitions {we consider an underdeveloped feature of de neys's model. decisions with multiple intuitions per option are neither trivial to explain nor rare. these decision scenarios are crucial for an assessment of the model's generalizability and adequacy. besides monitoring absolute differences in intuition strength, the mind might add the strengths of intuitions per choice option, leading to competing and testable hypotheses.}",-1,0.0,"germany, ontology, marriage, networks, multilingual"
JCDL2023 Workshop: Joint Workshop of the 4th Extraction and Evaluation of Knowledge Entities from Scientific Documents (EEKE2023) and the 3rd AI + Informetrics (AII2023),"{The 4th Workshop on Extraction and Evaluation of Knowledge Entities from Scientific Documents (EEKE 2023) and the 3rd AI + Informetrics (AII2023) will be held in New Mexico, USA and online at the ACM/IEEE Joint Conference on Digital Libraries (JCDL) 2023. The goal of these two workshop series (https://eeke-workshop.github.io/ and https://ai-informetrics.github.io/) are to engage the related communities in open problems in the extraction and evaluation of knowledge entities from scientific documents and the modeling and applications of AI + Informetrics for broad interests in science of science, science, technology, & innovation (ST&I), etc. This joint workshop consists of keynotes, oral presentations, and posters, and will attract not only academic researchers and librarians but also decision makers from governments and practical sectors.}",2023,Proceedings of the ACM/IEEE Joint Conference on Digital Libraries,"{artifical intelligence,informetrics,knowledge entity evaluation,knowledge entity extraction}",Engineering (all),,,OTHER,2023,"jcdl2023 workshop: joint workshop of the 4th extraction and evaluation of knowledge entities from scientific documents (eeke2023) and the 3rd ai + informetrics (aii2023) {the 4th workshop on extraction and evaluation of knowledge entities from scientific documents (eeke 2023) and the 3rd ai + informetrics (aii2023) will be held in new mexico, usa and online at the acm/ieee joint conference on digital libraries (jcdl) 2023. the goal of these two workshop series (https://eeke-workshop.github.io/ and https://ai-informetrics.github.io/) are to engage the related communities in open problems in the extraction and evaluation of knowledge entities from scientific documents and the modeling and applications of ai + informetrics for broad interests in science of science, science, technology, & innovation (st&i), etc. this joint workshop consists of keynotes, oral presentations, and posters, and will attract not only academic researchers and librarians but also decision makers from governments and practical sectors.} {artifical intelligence,informetrics,knowledge entity evaluation,knowledge entity extraction} {artifical intelligence,informetrics,knowledge entity evaluation,knowledge entity extraction}",-1,0.0,"germany, ontology, marriage, networks, multilingual"
Insider stories: analyzing internal sustainability efforts of major US companies from online reviews,"{It is hard to establish whether a company supports internal sustainability efforts (ISEs) like gender equality, diversity, and general staff welfare, not least because of a lack of methodologies operationalizing these internal sustainability practices, and of data honestly documenting such efforts. We developed and validated a six-dimension framework reflecting Internal Sustainability Efforts (ISEs), gathered more than 350K employee reviews of 104 major companies across the whole US for the (2008-2020) years, and developed a deep-learning framework scoring these reviews in terms of the six ISEs. Commitment to ISEs manifested itself at the micro-level—companies scoring high in ISEs enjoyed high stock growth. This new conceptualization of ISEs offers both theoretical implications for the literature on corporate sustainability and practical implications for companies and policy makers. To further explore these implications, researchers need to add potentially missing ISEs, to do so for more companies, and establish the causal relationship between company success and ISEs.}",2023,Humanities and Social Sciences Communications,,Psychology (all),,,OTHER,2023,"insider stories: analyzing internal sustainability efforts of major us companies from online reviews {it is hard to establish whether a company supports internal sustainability efforts (ises) like gender equality, diversity, and general staff welfare, not least because of a lack of methodologies operationalizing these internal sustainability practices, and of data honestly documenting such efforts. we developed and validated a six-dimension framework reflecting internal sustainability efforts (ises), gathered more than 350k employee reviews of 104 major companies across the whole us for the (2008-2020) years, and developed a deep-learning framework scoring these reviews in terms of the six ises. commitment to ises manifested itself at the micro-level—companies scoring high in ises enjoyed high stock growth. this new conceptualization of ises offers both theoretical implications for the literature on corporate sustainability and practical implications for companies and policy makers. to further explore these implications, researchers need to add potentially missing ises, to do so for more companies, and establish the causal relationship between company success and ises.}",-1,0.0,"germany, ontology, marriage, networks, multilingual"
Toxic comments are associated with reduced activity of volunteer editors on Wikipedia,"{Wikipedia is one of the most successful collaborative projects in history. It is the largest encyclopedia ever created, with millions of users worldwide relying on it as the first source of information as well as for fact-checking and in-depth research. As Wikipedia relies solely on the efforts of its volunteer editors, its success might be particularly affected by toxic speech. In this paper, we analyze all 57 million comments made on user talk pages of 8.5 million editors across the six most active language editions of Wikipedia to study the potential impact of toxicity on editors' behavior. We find that toxic comments are consistently associated with reduced activity of editors, equivalent to 0.5-2 active days per user in the short term. This translates to multiple human-years of lost productivity, considering the number of active contributors to Wikipedia. The effects of toxic comments are potentially even greater in the long term, as they are associated with a significantly increased risk of editors leaving the project altogether. Using an agent-based model, we demonstrate that toxicity attacks on Wikipedia have the potential to impede the progress of the entire project. Our results underscore the importance of mitigating toxic speech on collaborative platforms such as Wikipedia to ensure their continued success.}",2023,PNAS Nexus,,Multidisciplinary,Multidisciplinary,Multidisciplinary,OTHER,2023,"toxic comments are associated with reduced activity of volunteer editors on wikipedia {wikipedia is one of the most successful collaborative projects in history. it is the largest encyclopedia ever created, with millions of users worldwide relying on it as the first source of information as well as for fact-checking and in-depth research. as wikipedia relies solely on the efforts of its volunteer editors, its success might be particularly affected by toxic speech. in this paper, we analyze all 57 million comments made on user talk pages of 8.5 million editors across the six most active language editions of wikipedia to study the potential impact of toxicity on editors' behavior. we find that toxic comments are consistently associated with reduced activity of editors, equivalent to 0.5-2 active days per user in the short term. this translates to multiple human-years of lost productivity, considering the number of active contributors to wikipedia. the effects of toxic comments are potentially even greater in the long term, as they are associated with a significantly increased risk of editors leaving the project altogether. using an agent-based model, we demonstrate that toxicity attacks on wikipedia have the potential to impede the progress of the entire project. our results underscore the importance of mitigating toxic speech on collaborative platforms such as wikipedia to ensure their continued success.}",-1,0.0,"germany, ontology, marriage, networks, multilingual"
Insider stories: analyzing internal sustainability efforts of major US companies from online reviews,"{It is hard to establish whether a company supports internal sustainability efforts (ISEs) like gender equality, diversity, and general staff welfare, not least because of a lack of methodologies operationalizing these internal sustainability practices, and of data honestly documenting such efforts. We developed and validated a six-dimension framework reflecting Internal Sustainability Efforts (ISEs), gathered more than 350K employee reviews of 104 major companies across the whole US for the (2008-2020) years, and developed a deep-learning framework scoring these reviews in terms of the six ISEs. Commitment to ISEs manifested itself at the micro-level—companies scoring high in ISEs enjoyed high stock growth. This new conceptualization of ISEs offers both theoretical implications for the literature on corporate sustainability and practical implications for companies and policy makers. To further explore these implications, researchers need to add potentially missing ISEs, to do so for more companies, and establish the causal relationship between company success and ISEs.}",2023,Humanities and Social Sciences Communications,,"Economics, Econometrics and Finance (all)",,,OTHER,2023,"insider stories: analyzing internal sustainability efforts of major us companies from online reviews {it is hard to establish whether a company supports internal sustainability efforts (ises) like gender equality, diversity, and general staff welfare, not least because of a lack of methodologies operationalizing these internal sustainability practices, and of data honestly documenting such efforts. we developed and validated a six-dimension framework reflecting internal sustainability efforts (ises), gathered more than 350k employee reviews of 104 major companies across the whole us for the (2008-2020) years, and developed a deep-learning framework scoring these reviews in terms of the six ises. commitment to ises manifested itself at the micro-level—companies scoring high in ises enjoyed high stock growth. this new conceptualization of ises offers both theoretical implications for the literature on corporate sustainability and practical implications for companies and policy makers. to further explore these implications, researchers need to add potentially missing ises, to do so for more companies, and establish the causal relationship between company success and ises.}",-1,0.0,"germany, ontology, marriage, networks, multilingual"
Intersectionalities and im/mobilities in family and marriage: a comparative study of Germany and India,"{This article investigates comparative intersections of gender and family sociology internationally, with a specific focus on urban Germany and urban India. In particular, this research examines a central dynamic that informs family and marriage relations globally, and for this research context, in Germany and India: What are the nuanced ways of conceptualizing changing gender roles in marriage and in family in Germany and India? Bringing together a robust understanding of the theoretical frameworks of Intersectionality and of Mobility as large bodies of scholarship that examine geographic and symbolic power geometries, we adopt the lens of Intersectional Im/Mobilities to explore changing gender roles in family and marriage in Germany and India. We particularly focus on an intersectionality-based analysis of two primary themes that arise out of our primary and secondary data: (1) Women’s employment and impact on family life/work–life balance; and (2) Changing gender roles in marriage (through the lens of the division of household labor and aspects of agency and decision making), questions which influence and inflect complex intersectional realities.}",2024,Humanities and Social Sciences Communications,,"Economics, Econometrics and Finance (all)",,,OTHER,2024,"intersectionalities and im/mobilities in family and marriage: a comparative study of germany and india {this article investigates comparative intersections of gender and family sociology internationally, with a specific focus on urban germany and urban india. in particular, this research examines a central dynamic that informs family and marriage relations globally, and for this research context, in germany and india: what are the nuanced ways of conceptualizing changing gender roles in marriage and in family in germany and india? bringing together a robust understanding of the theoretical frameworks of intersectionality and of mobility as large bodies of scholarship that examine geographic and symbolic power geometries, we adopt the lens of intersectional im/mobilities to explore changing gender roles in family and marriage in germany and india. we particularly focus on an intersectionality-based analysis of two primary themes that arise out of our primary and secondary data: (1) women’s employment and impact on family life/work–life balance; and (2) changing gender roles in marriage (through the lens of the division of household labor and aspects of agency and decision making), questions which influence and inflect complex intersectional realities.}",-1,0.0,"germany, ontology, marriage, networks, multilingual"
Inductive Reasoning Renewed: A Reply to Commentators,"{The IRM provides a simple and flexible framework for the study of the social-perceptual phenomena of self-enhancement, intergroup accentuation, ingroup-favoritism, and differential accuracy of group perception, as well as the interdependencies of these phenomena. The commentaries on the target article (Krueger and colleagues) point to opportunities to further develop the model and to situate it in the context of contemporary theory and research in social and cognitive psychology. We address several critical issues of concern in this rejoinder. We organize our arguments along four themes of discussion: the model’s coherence, validity, sufficiency, and its timeliness. We close by suggesting that the IRM, beyond its proper domain of applicability represents a way of thinking about social perception characterized by parsimonious assumptions and precise predictions.}",2024,Psychological Inquiry,,Psychology (all),,,OTHER,2024,"inductive reasoning renewed: a reply to commentators {the irm provides a simple and flexible framework for the study of the social-perceptual phenomena of self-enhancement, intergroup accentuation, ingroup-favoritism, and differential accuracy of group perception, as well as the interdependencies of these phenomena. the commentaries on the target article (krueger and colleagues) point to opportunities to further develop the model and to situate it in the context of contemporary theory and research in social and cognitive psychology. we address several critical issues of concern in this rejoinder. we organize our arguments along four themes of discussion: the model’s coherence, validity, sufficiency, and its timeliness. we close by suggesting that the irm, beyond its proper domain of applicability represents a way of thinking about social perception characterized by parsimonious assumptions and precise predictions.}",-1,0.0,"germany, ontology, marriage, networks, multilingual"
For values in science: Assessing recent arguments for the ideal of value-free science,"{There is a near consensus among philosophers of science whose research focuses on science and values that the ideal of value-free science is untenable, and that science not only is, but normatively must be, value-laden in some respect. The consensus is far from complete; with some regularity, defenses of the value-free ideal (VFI) as well as critiques of major arguments against the VFI surface in the literature. I review and respond to many of the recent defenses of the VFI and show that they generally fail to meet the mark. In the process, I articulate what the current burden of argument for a defense of the VFI ought to be, given the state of the literature.}",2024,Synthese,,Social Sciences (all),,,OTHER,2024,"for values in science: assessing recent arguments for the ideal of value-free science {there is a near consensus among philosophers of science whose research focuses on science and values that the ideal of value-free science is untenable, and that science not only is, but normatively must be, value-laden in some respect. the consensus is far from complete; with some regularity, defenses of the value-free ideal (vfi) as well as critiques of major arguments against the vfi surface in the literature. i review and respond to many of the recent defenses of the vfi and show that they generally fail to meet the mark. in the process, i articulate what the current burden of argument for a defense of the vfi ought to be, given the state of the literature.}",-1,0.0,"germany, ontology, marriage, networks, multilingual"
Toward a causal model of curiosity and creativity,{We extend Ivancovsky et al.'s finding on the association between curiosity and creativity by proposing a sequential causal model assuming that (a) curiosity determines the motivation to seek information and that (b) creativity constitutes a capacity to act on that motivation. This framework assumes that both high levels of curiosity and creativity are necessary for information-seeking behavior.},2024,Behavioral and Brain Sciences,,Physiology,"Biochemistry, Genetics and Molecular Biology",Life Sciences,OTHER,2024,toward a causal model of curiosity and creativity {we extend ivancovsky et al.'s finding on the association between curiosity and creativity by proposing a sequential causal model assuming that (a) curiosity determines the motivation to seek information and that (b) creativity constitutes a capacity to act on that motivation. this framework assumes that both high levels of curiosity and creativity are necessary for information-seeking behavior.},-1,0.0,"germany, ontology, marriage, networks, multilingual"
