title,abstract,year,source,keyword,class_name,middle_group,subject_area,cluster,year_raw,clean_text,topic,topic_prob,topic_label
Integrating knowledge into conversational agents for worker upskilling,"{The labor market is a key part of an economy. Several existing online platforms allow the upload of resumes and the search for a job. One of their limitations, however, is that obtaining the best opportunity can be hard because certain jobs need some experiences, abilities, and features that an applicant might not know. The recent diffusion and employment of conversational agents definitely have proven to benefit this kind of issue. For example, ChatGPT has shown impressive outcomes in different domains and for a variety of tasks. It has weaknesses, although, related to the veracity of the responses it generates, which might deceive the user interacting with it. The usage of external domain knowledge is the direction we suggest in this chapter. Several lexical databases and taxonomies have already been collected and designed by different organizations. We illustrate a list of such resources and provide a solution that integrates conversational agents with relevant information extracted from one of such resources showing the benefits and the impact that our proposal can generate.}",2024,"Artificial Intelligence in Manufacturing: Enabling Intelligent, Flexible and Cost-Effective Production Through AI","{conversational agents,labor market,natural language processing,occupational databas,semantic web}",Computer Science (all),,,OTHER,2024,"integrating knowledge into conversational agents for worker upskilling {the labor market is a key part of an economy. several existing online platforms allow the upload of resumes and the search for a job. one of their limitations, however, is that obtaining the best opportunity can be hard because certain jobs need some experiences, abilities, and features that an applicant might not know. the recent diffusion and employment of conversational agents definitely have proven to benefit this kind of issue. for example, chatgpt has shown impressive outcomes in different domains and for a variety of tasks. it has weaknesses, although, related to the veracity of the responses it generates, which might deceive the user interacting with it. the usage of external domain knowledge is the direction we suggest in this chapter. several lexical databases and taxonomies have already been collected and designed by different organizations. we illustrate a list of such resources and provide a solution that integrates conversational agents with relevant information extracted from one of such resources showing the benefits and the impact that our proposal can generate.} {conversational agents,labor market,natural language processing,occupational databas,semantic web} {conversational agents,labor market,natural language processing,occupational databas,semantic web}",-1,0.0,"germany, ontology, marriage, networks, multilingual"
Dynamic predictability and activity-location contexts in human mobility,"{Human travelling behaviours are markedly regular, to a large extent predictable, and mostly driven by biological necessities and social constructs. Not surprisingly, such predictability is influenced by an array of factors ranging in scale from individual preferences and choices, through social groups and households, all the way to the global scale, such as mobility restrictions in response to external shocks such as pandemics. In this work, we explore how temporal, activity and location variations in individual-level mobility - referred to as predictability states - carry a large degree of information regarding the nature of mobility regularities at the population level. Our findings indicate the existence of contextual and activity signatures in predictability states, suggesting the potential for a more nuanced approach to estimating both short-term and higher-order mobility predictions. The existence of location contexts, in particular, serves as a parsimonious estimator for predictability patterns even in the case of low resolution and missing data.}",2024,Royal Society Open Science,"{complex systems,human mobility,information theory}",Multidisciplinary,Multidisciplinary,Multidisciplinary,OTHER,2024,"dynamic predictability and activity-location contexts in human mobility {human travelling behaviours are markedly regular, to a large extent predictable, and mostly driven by biological necessities and social constructs. not surprisingly, such predictability is influenced by an array of factors ranging in scale from individual preferences and choices, through social groups and households, all the way to the global scale, such as mobility restrictions in response to external shocks such as pandemics. in this work, we explore how temporal, activity and location variations in individual-level mobility - referred to as predictability states - carry a large degree of information regarding the nature of mobility regularities at the population level. our findings indicate the existence of contextual and activity signatures in predictability states, suggesting the potential for a more nuanced approach to estimating both short-term and higher-order mobility predictions. the existence of location contexts, in particular, serves as a parsimonious estimator for predictability patterns even in the case of low resolution and missing data.} {complex systems,human mobility,information theory} {complex systems,human mobility,information theory}",-1,0.0,"germany, ontology, marriage, networks, multilingual"
"Pancultural Nostalgia in Action: Prevalence, Triggers, and Psychological Functions of Nostalgia Across Cultures","{Nostalgia is a social, self-relevant, and bittersweet (although mostly positive) emotion that arises when reflecting on fond past memories and serves key psychological functions. The majority of evidence concerning the prevalence, triggers, and functions of nostalgia has been amassed in samples from a handful of largely Western cultures. If nostalgia is a fundamental psychological resource, it should perform similar functions across cultures, although its operational dynamics may be shaped by culture. This study (N = 2,606) examined dispositional nostalgia, self-reported triggers of nostalgia, and functions of experimentally induced nostalgia in young adults across 28 countries and a special administrative region of China (i.e., Hong Kong). Results indicated that nostalgia is frequently experienced across cultures, albeit better valued in more-developed countries (i.e., higher national wealth and life-expectancy). Nostalgia is triggered by psychological threats (especially in warmer countries), sensory stimuli (especially in more-developed countries), and social gatherings (especially in less-developed countries). The positive or negative affect prompted by experimentally induced nostalgia varied by country, but was mild overall. More importantly, recalling a nostalgic (vs. ordinary) memory increased social connectedness, self-continuity, and meaning in life across cultures. In less-developed countries, recalling an ordinary memory also conferred some of these functions, reducing the effect size of nostalgia. Finally, recalling a nostalgic (vs. ordinary) memory augmented state satisfaction with life in countries with lower quality of living (i.e., lower life-expectancy and life-satisfaction). Overall, findings confirm the relevance of nostalgia across a wide range of cultures and indicate cultural nuances in its functioning.}",2024,Journal of Experimental Psychology: General,"{culture,emotion,memory,nostalgia,well-being}",Psychology (all),,,OTHER,2024,"pancultural nostalgia in action: prevalence, triggers, and psychological functions of nostalgia across cultures {nostalgia is a social, self-relevant, and bittersweet (although mostly positive) emotion that arises when reflecting on fond past memories and serves key psychological functions. the majority of evidence concerning the prevalence, triggers, and functions of nostalgia has been amassed in samples from a handful of largely western cultures. if nostalgia is a fundamental psychological resource, it should perform similar functions across cultures, although its operational dynamics may be shaped by culture. this study (n = 2,606) examined dispositional nostalgia, self-reported triggers of nostalgia, and functions of experimentally induced nostalgia in young adults across 28 countries and a special administrative region of china (i.e., hong kong). results indicated that nostalgia is frequently experienced across cultures, albeit better valued in more-developed countries (i.e., higher national wealth and life-expectancy). nostalgia is triggered by psychological threats (especially in warmer countries), sensory stimuli (especially in more-developed countries), and social gatherings (especially in less-developed countries). the positive or negative affect prompted by experimentally induced nostalgia varied by country, but was mild overall. more importantly, recalling a nostalgic (vs. ordinary) memory increased social connectedness, self-continuity, and meaning in life across cultures. in less-developed countries, recalling an ordinary memory also conferred some of these functions, reducing the effect size of nostalgia. finally, recalling a nostalgic (vs. ordinary) memory augmented state satisfaction with life in countries with lower quality of living (i.e., lower life-expectancy and life-satisfaction). overall, findings confirm the relevance of nostalgia across a wide range of cultures and indicate cultural nuances in its functioning.} {culture,emotion,memory,nostalgia,well-being} {culture,emotion,memory,nostalgia,well-being}",-1,0.0,"germany, ontology, marriage, networks, multilingual"
Analysis of Web Browsing Data: A Guide,"{The use of individual-level browsing data, that is, the records of a person’s visits to online content through a desktop or mobile browser, is of increasing importance for social scientists. Browsing data have characteristics that raise many questions for statistical analysis, yet to date, little hands-on guidance on how to handle them exists. Reviewing extant research, and exploring data sets collected by our four research teams spanning seven countries and several years, with over 14,000 participants and 360 million web visits, we derive recommendations along four steps: preprocessing the raw data; filtering out observations; classifying web visits; and modelling browsing behavior. The recommendations we formulate aim to foster best practices in the field, which so far has paid little attention to justifying the many decisions researchers need to take when analyzing web browsing data.}",2024,Social Science Computer Review,"{computational social science,digital trace data,web browsing data,web tracking data}",Social Sciences (all),,,OTHER,2024,"analysis of web browsing data: a guide {the use of individual-level browsing data, that is, the records of a person’s visits to online content through a desktop or mobile browser, is of increasing importance for social scientists. browsing data have characteristics that raise many questions for statistical analysis, yet to date, little hands-on guidance on how to handle them exists. reviewing extant research, and exploring data sets collected by our four research teams spanning seven countries and several years, with over 14,000 participants and 360 million web visits, we derive recommendations along four steps: preprocessing the raw data; filtering out observations; classifying web visits; and modelling browsing behavior. the recommendations we formulate aim to foster best practices in the field, which so far has paid little attention to justifying the many decisions researchers need to take when analyzing web browsing data.} {computational social science,digital trace data,web browsing data,web tracking data} {computational social science,digital trace data,web browsing data,web tracking data}",-1,0.0,"germany, ontology, marriage, networks, multilingual"
Intersectionalities and im/mobilities in family and marriage: a comparative study of Germany and India,"{This article investigates comparative intersections of gender and family sociology internationally, with a specific focus on urban Germany and urban India. In particular, this research examines a central dynamic that informs family and marriage relations globally, and for this research context, in Germany and India: What are the nuanced ways of conceptualizing changing gender roles in marriage and in family in Germany and India? Bringing together a robust understanding of the theoretical frameworks of Intersectionality and of Mobility as large bodies of scholarship that examine geographic and symbolic power geometries, we adopt the lens of Intersectional Im/Mobilities to explore changing gender roles in family and marriage in Germany and India. We particularly focus on an intersectionality-based analysis of two primary themes that arise out of our primary and secondary data: (1) Women’s employment and impact on family life/work–life balance; and (2) Changing gender roles in marriage (through the lens of the division of household labor and aspects of agency and decision making), questions which influence and inflect complex intersectional realities.}",2024,Humanities and Social Sciences Communications,,Social Sciences (all),,,OTHER,2024,"intersectionalities and im/mobilities in family and marriage: a comparative study of germany and india {this article investigates comparative intersections of gender and family sociology internationally, with a specific focus on urban germany and urban india. in particular, this research examines a central dynamic that informs family and marriage relations globally, and for this research context, in germany and india: what are the nuanced ways of conceptualizing changing gender roles in marriage and in family in germany and india? bringing together a robust understanding of the theoretical frameworks of intersectionality and of mobility as large bodies of scholarship that examine geographic and symbolic power geometries, we adopt the lens of intersectional im/mobilities to explore changing gender roles in family and marriage in germany and india. we particularly focus on an intersectionality-based analysis of two primary themes that arise out of our primary and secondary data: (1) women’s employment and impact on family life/work–life balance; and (2) changing gender roles in marriage (through the lens of the division of household labor and aspects of agency and decision making), questions which influence and inflect complex intersectional realities.}",-1,0.0,"germany, ontology, marriage, networks, multilingual"
Group Formation in Science between Homogenization and Differentiation: Modeling the Development of U.S. and German Sociology,"{We assess the empirical development of scientific homogenization and differentiation processes in terms of group development comparing U.S. and German sociology from 2004 to 2019. We introduce hierarchical multi-layered Bayesian stochastic block models to the issue of scientific group development. Based on publication data from Scopus, we analyze group formation simultaneously as collaboration networks, reference networks, and topical networks. Employing this method allows us to trace back the temporal dynamics of multidimensional group development and formation for each national scientific field. Overall, the findings indicate clear path dependencies in both fields that have been shaping processes of differentiation and homogenization in U.S. and German sociology and that continue to impact on the formation, stabilization, and dissolution of scientific groups.}",2024,International Journal of Sociology,"{citation,collaboration,sociology of science,stochastic blockmodel,topics}",Social Sciences (all),,,OTHER,2024,"group formation in science between homogenization and differentiation: modeling the development of u.s. and german sociology {we assess the empirical development of scientific homogenization and differentiation processes in terms of group development comparing u.s. and german sociology from 2004 to 2019. we introduce hierarchical multi-layered bayesian stochastic block models to the issue of scientific group development. based on publication data from scopus, we analyze group formation simultaneously as collaboration networks, reference networks, and topical networks. employing this method allows us to trace back the temporal dynamics of multidimensional group development and formation for each national scientific field. overall, the findings indicate clear path dependencies in both fields that have been shaping processes of differentiation and homogenization in u.s. and german sociology and that continue to impact on the formation, stabilization, and dissolution of scientific groups.} {citation,collaboration,sociology of science,stochastic blockmodel,topics} {citation,collaboration,sociology of science,stochastic blockmodel,topics}",-1,0.0,"germany, ontology, marriage, networks, multilingual"
The interplay of structural features and observed dissimilarities among centrality indices,"{An abundance of centrality indices has been proposed which capture the importance of nodes in a network based on different structural features. While there remains a persistent belief that similarities in outcomes of indices is contingent on their technical definitions, a growing body of research shows that structural features affect observed similarities more than technicalities. We conduct a series of experiments on artificial networks to trace the influence of specific structural features on the similarity of indices which confirm previous results in the literature. Our analysis on 1163 real-world networks, however, shows that little of the observations on synthetic networks convincingly carry over to empirical settings. Our findings suggest that although it seems clear that (dis)similarities among centralities depend on structural properties of the network, using correlation type analyses do not seem to be a promising approach to uncover such connections.}",2024,Social Networks,"{centrality,correlation,network topology,threshold graphs}",Social Sciences (all),,,OTHER,2024,"the interplay of structural features and observed dissimilarities among centrality indices {an abundance of centrality indices has been proposed which capture the importance of nodes in a network based on different structural features. while there remains a persistent belief that similarities in outcomes of indices is contingent on their technical definitions, a growing body of research shows that structural features affect observed similarities more than technicalities. we conduct a series of experiments on artificial networks to trace the influence of specific structural features on the similarity of indices which confirm previous results in the literature. our analysis on 1163 real-world networks, however, shows that little of the observations on synthetic networks convincingly carry over to empirical settings. our findings suggest that although it seems clear that (dis)similarities among centralities depend on structural properties of the network, using correlation type analyses do not seem to be a promising approach to uncover such connections.} {centrality,correlation,network topology,threshold graphs} {centrality,correlation,network topology,threshold graphs}",-1,0.0,"germany, ontology, marriage, networks, multilingual"
The interplay of structural features and observed dissimilarities among centrality indices,"{An abundance of centrality indices has been proposed which capture the importance of nodes in a network based on different structural features. While there remains a persistent belief that similarities in outcomes of indices is contingent on their technical definitions, a growing body of research shows that structural features affect observed similarities more than technicalities. We conduct a series of experiments on artificial networks to trace the influence of specific structural features on the similarity of indices which confirm previous results in the literature. Our analysis on 1163 real-world networks, however, shows that little of the observations on synthetic networks convincingly carry over to empirical settings. Our findings suggest that although it seems clear that (dis)similarities among centralities depend on structural properties of the network, using correlation type analyses do not seem to be a promising approach to uncover such connections.}",2024,Social Networks,"{centrality,correlation,network topology,threshold graphs}",Psychology (all),,,OTHER,2024,"the interplay of structural features and observed dissimilarities among centrality indices {an abundance of centrality indices has been proposed which capture the importance of nodes in a network based on different structural features. while there remains a persistent belief that similarities in outcomes of indices is contingent on their technical definitions, a growing body of research shows that structural features affect observed similarities more than technicalities. we conduct a series of experiments on artificial networks to trace the influence of specific structural features on the similarity of indices which confirm previous results in the literature. our analysis on 1163 real-world networks, however, shows that little of the observations on synthetic networks convincingly carry over to empirical settings. our findings suggest that although it seems clear that (dis)similarities among centralities depend on structural properties of the network, using correlation type analyses do not seem to be a promising approach to uncover such connections.} {centrality,correlation,network topology,threshold graphs} {centrality,correlation,network topology,threshold graphs}",-1,0.0,"germany, ontology, marriage, networks, multilingual"
