Topic,Words,Frequency,Timestamp
-1,"momatch, string similarity techniques, natural languages, ontology matching, seven metrics used",10,2023
0,"german, educational, networks, consolidation, personality",10,2023
1,"sustainability efforts ises, enjoyed high stock, establish causal relationship, explore need add, establish company",6,2023
-1,"germany india, lens, gender roles marriage, intersectionality, conversational agents",12,2024
0,"social, nostalgia, ict sc, structural features, growth",11,2024
1,"regularity defenses value, capabilities peace establishment, current burden, consensus philosophers science, far complete",2,2024
-1,"categorization, repositories, identity, domains, transfer",8,2025
0,"acceptance, priors, simulated, transparent group, cognition past cultures",6,2025
1,"replicability, evidence based, proposed, plays central role, world disciplines social",8,2025
